mal_id,image_url,title,synopsis,source,genres,demographics,is_franchise,members,episodes,year,season,producer_id,studio_id,score
62126,https://myanimelist.net/images/anime/1421/154342.webp,SI-VIS: The Sound of Heroes,"SI-VIS is a co-ed music group, led by Yosuke, shaking up the global music scene with their unmatched vocals and performances. However, they are actually heroes in disguise, battling against mysterious forces threatening the world. They convert audience energy at live performances into combat power. Luckily, the battles appear to be ordinary concerts to the public, keeping their identity a secret.

(Source: Crunchyroll)",Original,['Action'],[],0,9426,24,2025,fall,"[17, 169, 213, 757, 1468]",[1244],6.36
62378,https://myanimelist.net/images/anime/1333/151768.webp,Ganglion,"Early 2000s Tokyo. Isobe, a combatant for the evil corporation Ganglion, spends his days on the battlefield. Whether it's the ""Tokyo Cedar Pollen Operation"" or the ""Mount Fuji Demolition Plan,"" he faces off in nothing but a bodysuit, only to be crushed by the hero Hopeman time and again. As he struggles under unreasonable bosses during the dawn of compliance, his story unfolds—a workplace drama dedicated to all who work, following the bittersweet life of a salaryman soldier.

(Source: MAL News)",Manga,"['Action', 'Comedy']",[],0,8704,24,2025,fall,"[238, 1820, 2640, 3206, 3218]",[3186],6.44
62066,https://myanimelist.net/images/anime/1090/151875.webp,Monster Strike: Deadverse Reloaded,"Rinne is a girl who cannot see other people's faces. Born into a family whose job it is to exorcise supernatural beings, she sets out on her first mission, but encounters an enemy far more bizarre than she expected. She finds herself in danger.

After being rescued by a mysterious man named Jugemu, Rinne learns that all worlds, including the one she lives in, known as ""Strike Worlds,"" are under threat. As she travels with Jugemu through a number of worlds that are coming to an end, she forms bonds with him...

(Source: Official Site)",Game,"['Action', 'Fantasy']",[],0,5441,10,2025,fall,"[306, 1406, 1966, 2681]",[96],5.84
61184,https://myanimelist.net/images/anime/1614/153337.webp,Nohara Hiroshi: Hiru Meshi no Ryuugi,"This series follows Hiroshi Nohara's ultimate lunchtime philosophy, as he carefully selects and enjoys his midday meals within the constraints of a limited budget and break time.

But it's not just about savoring food—Hiroshi delves into cooking trivia, preparation methods, and the everyday dilemmas of a salaryman. From debating whether to treat his juniors to lunch, to finding quick meals between sales meetings, and even venting about his boss, the series is packed with relatable moments for working professionals.

(Source: MAL News)",Manga,"['Comedy', 'Gourmet']",[],0,4339,12,2025,fall,"[55, 247, 1377, 2118, 2185, 2424]",[276],6.71
62496,https://myanimelist.net/images/anime/1279/154187.webp,2200-nen Neko no Kuni Nippon,"Takes place in the year 2200, where Japan has become a land of cats as the human population's birth rate has declined. In this future world, cats can talk, learn, and work. The story follows a high school girl and her argumentative cat.

(Source: ANN)",4-koma manga,"['Sci-Fi', 'Slice of Life']",[],0,2141,12,2025,fall,[],"[2844, 2983]",5.66
62522,https://myanimelist.net/images/anime/1657/152125.webp,Chou Futsuu Mahou Shoujo Asumi Toruverse,"Mito Hamajoh, a second-year middle school student living in Chiba City, has always struggled with being ""normal."" Then, just before summer vacation, a mysterious transfer student, Asumi Chishiro, who dares to say, ""I'm not interested in normal things,"" arrives.

(Source: X, translated)",Original,['Comedy'],[],1,1745,13,2025,fall,[61],[2080],
60551,https://myanimelist.net/images/anime/1223/151728.webp,Hyakushou Kizoku 3rd Season,Third season of Hyakushou Kizoku.,Manga,['Comedy'],['Shoujo'],1,1717,12,2025,fall,[],[1229],6.83
54160,https://myanimelist.net/images/anime/1424/151473.webp,Future Kid Takara,"Future Kid Takara will be an action-packed, family-oriented film set in a dystopian future. The adventure story will feature a girl named Sara who is time warped into the year 2100, where she and the protagonist Takara try to navigate a world ravaged by the effects of global warming. Title and story subject to change

(Source: Kickstarter)",Original,['Drama'],[],0,1246,11,2025,fall,[],[13],
62643,https://myanimelist.net/images/anime/1684/154189.webp,Anila to Cocora,"Centers on sea otter brothers Anila and Cocora, who live at a certain aquarium. Anila is the older brother who is cool, but also has a naive side. The younger brother Cocora is a passionate otter who adores his older brother.

(Source: ANN)",Original,['Slice of Life'],[],0,1241,13,2025,fall,"[1077, 3307]",[432],5.46
62682,https://myanimelist.net/images/anime/1508/152511.webp,Sawaranaide Kotesashi-kun Mini Anime Gekijou,A weekly mini anime shown with each episode of Sawaranaide Kotesashi-kun exclusively on the AT-X broadcast of the TV anime and online on OceanVeil.,Web manga,['Comedy'],[],0,736,12,2025,fall,[],[],5.73
60983,https://myanimelist.net/images/anime/1191/151082.webp,Kagaku x Bouken Survival! 2nd Season,Second season of Kagaku x Bouken Survival!.,Manga,"['Action', 'Comedy']",['Shounen'],1,589,19,2025,fall,[],[36],
62268,https://myanimelist.net/images/anime/1334/151528.webp,Chikyuu no Latair,,Picture book,[],[],0,409,5,2025,fall,[2174],[3197],
62231,https://myanimelist.net/images/anime/1017/151409.webp,Jochum Season 2,Second season of Jochum.,Original,['Slice of Life'],[],1,360,24,2025,fall,[150],[866],
61924,https://myanimelist.net/images/anime/1336/152128.webp,Muzik Tiger In the Forest 2nd Season,Second season of Muzik Tiger In the Forest.,Other,['Slice of Life'],[],1,356,17,2025,fall,[],[2705],
61922,https://myanimelist.net/images/anime/1958/152020.webp,Shibuya♡Hachi Part 4,Part 4 of Shibuya♡Hachi.,Other,['Comedy'],[],1,348,12,2025,fall,"[717, 1344]",[22],
62523,https://myanimelist.net/images/anime/1745/152126.webp,Uso Tantei Tomanto,"The ""authentic mystery"" story follows Tomanto and friends as they solve mysteries using vegetable and fruit trivia.

(Source: ANN)",Other,['Mystery'],[],0,337,26,2025,fall,[261],[866],
62654,https://myanimelist.net/images/anime/1153/152436.webp,Princess Catch! Tiniping,Sixth season of Catch! Tiniping.,Original,[],[],1,331,26,2025,fall,[],[2541],
62447,https://myanimelist.net/images/anime/1788/151966.webp,Bugchon 5-lagil Ssangdungine,,Original,['Comedy'],[],0,254,0,2025,fall,[],[3217],
62561,https://myanimelist.net/images/anime/1543/152209.webp,Koikeya SDGs Gekijou Suss to Tina Season 6,Sixth season of Koikeya SDGs Gekijou Suss to Tina.,Original,"['Action', 'Comedy']",[],1,228,13,2025,fall,[],[3205],
62504,https://myanimelist.net/images/anime/1126/152091.webp,Sylvanian Families: Freya no Wonder Days,,Other,['Slice of Life'],['Kids'],1,223,12,2025,fall,[],[563],
62915,https://myanimelist.net/images/anime/1962/153512.webp,Sorotani no Keibatchi Season 3,Third season of Sorotani no Keibatchi.,Original,"['Comedy', 'Sports']",[],1,185,4,2025,fall,[],[276],
63093,https://myanimelist.net/images/anime/1907/154236.webp,Wo De Nazha Yu Bianxing Jingang,,Other,"['Action', 'Fantasy', 'Sci-Fi']",['Kids'],0,167,52,2025,fall,[],[],
62664,https://myanimelist.net/images/anime/1422/152461.webp,Xiong Chumo: Shenqi Baowu,,Original,"['Adventure', 'Fantasy']",['Kids'],1,153,52,2025,fall,[],[2611],
62680,https://myanimelist.net/images/anime/1108/152498.webp,Dinoster: Gonglyongsuhodae 3rd Season,Third season of Dinoster: Gonglyongsuhodae.,Original,"['Comedy', 'Sci-Fi']",['Kids'],1,145,26,2025,fall,[],[],
62875,https://myanimelist.net/images/anime/1151/153163.webp,Naui Bimilchingu Haechi,,Original,"['Comedy', 'Fantasy']",['Kids'],0,126,0,2025,fall,[],[],
