mal_id,image_url,title,synopsis,source,genres,demographics,is_franchise,members,episodes,year,season,producer_id,studio_id,score
61930,https://myanimelist.net/images/anime/1120/152280.webp,Uma Musume: Cinderella Gray Part 2,"Ever since horse girl Oguri Cap left the small town of Kasamatsu to chase greater heights in Tokyo, she has rapidly gained attention with her remarkable results. Her goal to become the best horse girl in Japan seems within reach, but there is a rival in her way—another running prodigy named Tamamo Cross.

However, Tamamo is not the only threat to Oguri: several world-class racers from overseas are joining the Japan Cup, pushing the renowned race's competition to unprecedented levels. With the support from the people close to her and her intense desire to win, Oguri will do anything to conquer the Japan Cup and continue sprinting for the top.

[Written by MAL Rewrite]",Manga,"['Drama', 'Sports']",['Seinen'],1,63392,10,2025,fall,"[145, 1397, 1587, 2074, 2751]",[1893],8.68
57888,https://myanimelist.net/images/anime/1811/151799.webp,"Chichi wa Eiyuu, Haha wa Seirei, Musume no Watashi wa Tenseisha.","After a long time of absence, Tenbahl's hero, Rovel Vankreift, finally returns home from the Spirit Realm—alive—but forever changed. Ten years ago, after being grievously wounded due to a massive battle against a horde of monsters, he was saved by Origin, the Queen of Spirits. Through her intervention, Rovel was healed by becoming half-spirit, and soon after, the two were wed. From their union, Ellen was born, a brilliant child who inherited her mother's ethereal power and her father's enduring humanity.

In truth, Ellen's genius stems from memories of a past life in Japan, where she once lived as a devoted chemist. Using her extensive understanding of the periodic table and all elemental permutations, she commands the very building blocks of matter itself, turning anything into everything she desires. Unfortunately, this means that any revelation of her existence could easily draw the attention of those who may want to exploit her and undoubtedly upend the fragile balance between the human and spirit realms.

As Rovel resumes his duties as a noble, Ellen gradually becomes exposed to the dangers that lie ahead. With her growing powers attracting admiration and malice alike, the young reincarnator must learn what it truly means to be the child of two worlds and potentially be the catalyst toward uniting both.

[Written by MAL Rewrite]",Light novel,['Fantasy'],[],0,61938,12,2025,fall,"[29, 306, 323, 460, 1414, 1696]",[7],6.64
61159,https://myanimelist.net/images/anime/1455/152139.webp,Toujima Tanzaburou wa Kamen Rider ni Naritai,"Tanzaburou Toujima has spent his entire life chasing a dream: to become Kamen Rider. Now, at 40, reality has nearly caught up with him, and he's on the verge of letting go of his childhood fantasy.

That is, until he gets caught up in a crime wave led by the ""Fake Shocker"" gang—turning his long-time dream into something far more dangerous.

What starts as a pretend hero's journey quickly becomes something real. The ultimate Kamen Rider fantasy is about to begin!

(Source: MAL News)",Manga,"['Action', 'Comedy']",['Seinen'],0,61556,24,2025,fall,"[17, 719, 1211, 1468, 1653]",[839],7.81
60427,https://myanimelist.net/images/anime/1257/152352.webp,Gnosia,"Saddled with amnesia, Yuuri awakens on an interstellar cruiser drifting through space. Unfortunately, a lack of memories is the least of Yuuri's problems. Among the four other crew members is a Gnosia: a Gnos infectee whose goal is the eradication of humanity. The Gnosia appears human in all other respects, so the uninfected have little choice but to vote on whom they suspect to be the enemy, hoping to neutralize the Gnosia by putting them into cold sleep. If the Gnosia survives the vote, they will eliminate one crew member during the cruiser's following warp, when only the Gnosia remains conscious.

Voting quickly proves to be an unreliable strategy, and Yuuri is left one-on-one with the Gnosia. Just when all hope seems lost, time seemingly loops back to when Yuuri first awakened. With each time loop, however, conditions aboard the ship change—neither the size of the crew nor the members' identities remain constant. Trapped in both time and space, Yuuri must figure out how to escape the loops and save humanity from the Gnosia.

[Written by MAL Rewrite]",Game,"['Sci-Fi', 'Suspense']",[],0,51272,21,2025,fall,"[17, 166, 719, 1211, 1416]",[1380],7.86
61851,https://myanimelist.net/images/anime/1044/152103.webp,Isekai Quartet 3,Third season of Isekai Quartet.,Original,"['Comedy', 'Fantasy']",[],1,49413,11,2025,fall,"[306, 1696]",[443],7.44
61209,https://myanimelist.net/images/anime/1363/151886.webp,Kao ni Denai Kashiwada-san to Kao ni Deru Oota-kun,"Oota-kun wears his heart on his sleeve; his face reveals his every thought and emotion. In contrast, Kashiwada-san remains unreadable, as her expression never changes, no matter what happens. Bothered by Kashiwada-san's perpetual expressionlessness, Oota-kun makes it his mission to break through her calm exterior, pulling every prank and trick he can think of—from fake spiders to absurd text messages and everything in between—just to get a reaction.

As Oota-kun's relentless attempts fail to crack Kashiwada-san's perpetual poker face, their exchanges become the daily norm. Unbeknownst to him, however, his antics occasionally succeed in drawing out a subtle smile—not noticing that he has already cracked her defense since the beginning.

[Written by MAL Rewrite]",Web manga,"['Comedy', 'Romance']",[],0,48988,12,2025,fall,"[166, 460, 1113, 1211, 1412, 1416, 1696, 2228, 2840]",[2828],7.05
59484,https://myanimelist.net/images/anime/1618/151138.webp,Kikaijikake no Marie,"Wealthy, handsome, and successful, Arthur Louis Zetes is no stranger to the greed of people. Constantly doubting those around him, he has no faith in humanity; thus, he makes a request for the perfect maid—a robot maid. However, his butler is unable to acquire such a servant due to technological limitations, so he finds the next best substitute.

Marie Evans is a former child prodigy in martial arts known for her lack of expression. Drowning in debt, she readily accepts the offer to be a maid that acts like a robot. While Arthur is often blunt towards humans, he cannot help but dote on his personal robot; in turn, Marie is moved by his drive and consideration toward her.

[Written by MAL Rewrite]",Manga,"['Comedy', 'Romance']",['Shoujo'],0,46433,12,2025,fall,"[62, 144, 148, 460, 843, 1401, 1492, 1651, 3211]","[1379, 2527]",6.92
58515,https://myanimelist.net/images/anime/1593/155372.webp,Kekkon Yubiwa Monogatari II,Second season of Kekkon Yubiwa Monogatari.,Manga,"['Action', 'Fantasy', 'Romance', 'Ecchi']",['Seinen'],1,46237,13,2025,fall,"[58, 141, 144, 238, 460, 719, 1333, 1416, 1883, 2228]",[2405],6.46
54757,https://myanimelist.net/images/anime/1823/154120.webp,3-nen Z-gumi Ginpachi-sensei,"Class 3-Z of Gintama High School—led by teacher Ginpachi Sakata—is known for its eccentric students who have a difficult time with their studies. Moreover, Ginpachi and his students often run into trouble with the school's demanding principal and the class' feared delinquents, who have returned from a suspension.

Despite all the chaos and Ginpachi's idle attitude toward teaching, his students still dearly respect him. Although constantly derailed from their studies, Ginpachi and his zany class always find a way to keep their school days entertaining.

[Written by MAL Rewrite]",Light novel,['Comedy'],['Shounen'],0,45723,12,2025,fall,"[16, 17, 53, 643, 1365, 1406]",[1258],7.65
58146,https://myanimelist.net/images/anime/1347/150603.webp,Tensei Akujo no Kuro Rekishi,"Konoha Satou has a dark history. After all, she spent her teen years writing self-indulgent fantasy romance fics-like her Dark History. But since she's become its most despicable villainess, remembering every last detail is now a matter of life-and-death. Having avoided the first couple of death flags, Satou's suddenly left in the dark when a mysterious stranger returns from the Lily Kingdom-a character she doesn't recall writing in the original script. Although Yomi claims to be her ally, can Satou really trust a character she knows nothing about in such a dangerous world?

(Source: Yen Press)",Manga,"['Comedy', 'Fantasy', 'Romance']",['Shoujo'],0,44860,12,2025,fall,"[16, 82, 148, 213, 460, 1185, 1416, 1590, 2999, 3063]",[37],6.73
60969,https://myanimelist.net/images/anime/1475/152176.webp,Taiyou yori mo Mabushii Hoshi,"Sae Iwata was never cute or dainty like the other girls, and due to her build and strength, she always felt the need to look after her delicate childhood friend and crush, Kouki Kamishiro. But as years passed, Kouki grew taller and more confident, which resulted in them drifting apart.

Toward the end of middle school, Sae reconnects with Kouki. Seeing that Kouki is still the sweet boy she once knew, she realizes that her dormant feelings for him have resurfaced. She tries her best to suppress her emotions—but it becomes even more difficult as, come high school, they end up in the same class. Ignoring her deepening feelings may seem like a fool's errand, but this boy that shines brighter than the sun may just prove to be her destiny.

[Written by MAL Rewrite]",Manga,['Romance'],['Shoujo'],0,42817,12,2025,fall,"[145, 166, 315, 1397, 1585, 1986, 1996, 2111]",[1997],7.33
61142,https://myanimelist.net/images/anime/1025/150482.webp,Sawaranaide Kotesashi-kun,"Seiwa University High School is renowned for its elite athletes and national-level sports teams. Despite not playing any sports himself, Kouyou Kotesashi enters the school hoping to become a sports doctor and accepts a live-in position as a dormitory's caretaker. Upon his arrival, Kotesashi learns that the dorm is also home to five skilled female athletes: Aroma Kusunoki, Miyuki Hongou, Izumi Sumiyoshi, Chiyo Sayamagaoka, and Aoba Kitahara.

Although faced with skepticism, Kotesashi quickly proves his worth by using his vast knowledge of the human body and massage techniques. With a single touch, he identifies what is troubling each of the girls and helps them recover properly. When the chairman promises him a scholarship if he takes care of the girls' well-being, Kotesashi is determined to ensure that they stay in top shape.

[Written by MAL Rewrite]",Web manga,"['Sports', 'Ecchi']",[],0,42244,12,2025,fall,"[2640, 2892, 3112]",[2314],6.13
59623,https://myanimelist.net/images/anime/1104/151524.webp,Wandance,"As Kaboku ""Kabo"" Kotani enrolls in Ichiran High School, he hopes to spend his high school days quietly to avoid standing out from everyone else because of his stuttering. While his friends join the school's basketball club, he looks to the dance club instead. However, due to an embarrassing memory from middle school, Koba has avoided dancing in front of others again, keeping him from joining the club.

Things begin to change when Kabo spots his cute classmate Hikari Wanda dancing. As the two learn about each other, Wanda admits that she is not great with words either and prefers to express herself with her performances. This sparks a light in Kabo, and he decides to join the dance club despite his uncomfortable past. With Wanda and his new clubmates supporting him, Kabo sets out to improve his dancing, express himself freely, and create unforgettable memories one step at a time.

[Written by MAL Rewrite]",Manga,['Sports'],['Seinen'],0,41192,12,2025,fall,"[55, 159, 517, 1294, 3216]","[11, 1099]",6.98
60933,https://myanimelist.net/images/anime/1888/151887.webp,Chanto Suenai Kyuuketsuki-chan,"In the city of Kashinokidai, where humans coexist with other beings, one individual stands out even among this diversity. Transfer student Luna Ishikawa, a vampire with a cool and mysterious aura, captivates her classmates and gains instant popularity.

Tatsuta Ootori, an otherwise unremarkable boy, believes that Ishikawa is far beyond his reach. However, when the two are paired for cleaning duty, Ootori discovers that beneath Luna's composed exterior lies an ironic secret. She cannot properly suck blood, forcing her to eat snacks to hide her weakness—but no amount ever seems to satisfy her.

Determined to help Luna master the very skill that defines her kind, Tatsuta offers himself as her practice partner. Through trial, error, and multiple bandages, their unassuming high school days take on a peculiar warmth—one where Luna no longer needs to act flawlessly and can simply be her natural, adorably awkward self.

[Written by MAL Rewrite]",Manga,"['Comedy', 'Fantasy']",['Shounen'],0,39195,12,2025,fall,"[104, 238, 460, 719, 1211, 1412, 1583, 1696, 1986, 2185, 2425, 2751]",[91],6.86
60765,https://myanimelist.net/images/anime/1810/153334.webp,Kimi to Koete Koi ni Naru,"When high schooler Mari bumps into a fellow tardy student, she's surprised to find out he's a beastfolk who's to attend her school! After all, it's not rare for beastfolk to coexist alongside humans, but it's still uncommon, with the prejudice and all. Nervous to meet one at first, Mari soon learns there's more to him than his furry exterior. In fact, the more she gets to know him, the more she finds herself drawn to him, his steadfastness, his kindheartedness, and... his body...

(Source: Yen Press)",Web manga,"['Fantasy', 'Romance']",[],0,38719,12,2025,fall,"[719, 1365, 3103, 3156]",[1237],7.14
61517,https://myanimelist.net/images/anime/1282/151476.webp,Kingdom 6th Season,"In ancient China, during the Warring States period, a former servant named Xin rises through the ranks with a dream: to become the greatest general under the heavens. Fighting alongside King Ying Zheng of Qin—who seeks to unify China and end the chaos—Xin leads his own unit, the Fei Xin Force, onto the battlefield.

With power reclaimed from the influential Chancellor Buwei Lü, King Ying Zheng begins laying the groundwork for a new, unified legal state with the support of key allies like strategist Changping Jun and legalist Li Si.

As Qin launches a campaign to seize new territory from the state of Zhao, their advance is halted by the brilliant strategist, Li Mu. In response, Changping Jun devises a bold plan: to bypass Zhao's defenses and strike at the key city of Gyou, near Zhao's capital.

To carry out this risky maneuver, a powerful coalition army is formed—led by the tacticians Ou Sen (Wang Jian), Kan Ki (Huan Yi), and the warrior queen Yo Tan Wa (Yang Duanhe). Joining them are the next generation of Qin commanders: Xin's Fei Xin Force, Mou Ten (Meng Tian)'s Gaku Ka Unit, and Ou Hon (Wang Ben)'s Gyoku Hou Unit, each operating independently.

The fierce battle for Gyou begins, as the future of Qin's unification hangs in the balance.

(Source: MAL News)",Manga,['Action'],['Seinen'],1,38026,13,2025,fall,"[1284, 1365, 1797]","[1, 1998]",8.67
61773,https://myanimelist.net/images/anime/1148/150376.webp,Let's Play: Quest-darake no My Life,"Through her college years, Sam Young devoted hours upon hours to developing her adventure puzzle game, Ruminate. Despite being very ill as a child, Sam aspires to become a true game developer. But when her favorite gaming streamer, Marshall Law, tests the game, he horribly misunderstands it and declares it the worst game he has ever played. As a result, his fans bombard Sam's game with negative reviews, jeopardizing her dreams.

To make matters worse, Marshall moves in as Sam's new neighbor, unaware that she is the developer he so harshly criticized. Although he appears caring and kind, she struggles to befriend him. Before she can develop her second game, Evermake, Sam must first figure out a way to repair her ruined reputation.

[Written by MAL Rewrite]",Other,"['Drama', 'Romance']",[],0,33025,12,2025,fall,"[169, 460, 735, 769, 1412, 1468, 1499, 1556, 1563]",[28],6.76
58772,https://myanimelist.net/images/anime/1619/151364.webp,Kakuriyo no Yadomeshi Ni,Second season of Kakuriyo no Yadomeshi.,Light novel,"['Drama', 'Fantasy', 'Gourmet', 'Romance']",[],1,30676,12,2025,fall,"[464, 719, 1468, 1612]","[3, 2622]",6.84
60781,https://myanimelist.net/images/anime/1631/153644.webp,Alma-chan wa Kazoku ni Naritai,"The Apotheosis Loyal Maneuver Arms—Alma—is the flagship prototype of Enji Kamisato and Suzume Yobane, two gifted researchers disillusioned by the arrogance of their peers. Although designed for combat, Alma's daily life ironically unfolds far from any battlefield, as she is fine-tuned for ordinary society. Nevertheless, within the modest household she shares with her creators-turned-parents, she learns the subtleties of being human little by little.

Meanwhile, Enji and Suzume, as self-proclaimed rivals, remain oblivious to how transparent their affection for each other truly is. Alma, observing their every exchange with methodical precision, is hardly deceived. As the pair continue their quarrels under the guise of research, Alma adapts to the rhythm of a homely life—finding comfort in the everyday shenanigans that make them a family.

[Written by MAL Rewrite]",Web manga,"['Comedy', 'Romance', 'Sci-Fi']",[],0,30250,11,2025,fall,"[104, 238, 1355, 1604, 1696, 2185, 2425, 2545, 2640]",[1693],7.09
57859,https://myanimelist.net/images/anime/1617/151874.webp,Egao no Taenai Shokuba desu.,"New shoujo manga artist Nana Futami works hard every day while being supported by Kaede Satou, her female editor who is older than her, and Mizuki Hazama, her assistant. According to the girl herself, she sometimes drums up intense daydream delusions of occupational illness! A working girls comedy set in the entertainment industry, brought to you by an author who always draws various girls.

(Source: Kodansha, translated)",Web manga,['Comedy'],[],0,26492,13,2025,fall,"[144, 238, 460, 1041, 1211, 1817, 1986, 2185, 2751, 3224]",[2698],7.47
61269,https://myanimelist.net/images/anime/1776/151242.webp,Digimon Beatbreak,"Tomorou Tenma possesses a uniquely strong e-Pulse—the energy created by human thoughts and emotions that powers egg-shaped AI devices named Sapotama. The world's everyday life relies on the assistance of Sapotamas, but the force of Tomorou's e-Pulse often causes glitches in them. One night, a strange creature calling itself Gekkoumon emerges from his device and insists on eating Tomorou's e-Pulse.

Gekkoumon is a Digimon, a creature feeding on e-Pulse that was born from an error in Sapotamas. Some Digimon completely drain humans of their energy, leaving them in a comatose state known as Cold Heart. When Tomorou's older brother, Asuka, becomes a victim of this phenomenon, Tomorou vows to avenge him.

Tomorou meets a group of Digimon-wielders called Glowing Dawn, who hunt down rogue Digimon for bounties. Their leader, Kyou Sawashiro, explains that there might still be hope for Asuka's recovery. Although Tomorou struggles to trust these strangers, he decides to join them, as he realizes that saving his brother may not be achievable on his own.

[Written by MAL Rewrite]",Other,"['Action', 'Fantasy', 'Sci-Fi']",[],0,25614,0,2025,fall,"[127, 169, 1761]",[18],7.18
61072,https://myanimelist.net/images/anime/1681/151599.webp,Shuumatsu Touring,"All alone after the end of days, two girls bike through the empty ruins of Japan—and they're not about to let the collapse of civilization get in the way of sightseeing! Even when the world ends, their journey goes on.

(Source: Yen Press)",Manga,"['Adventure', 'Sci-Fi', 'Slice of Life']",['Seinen'],0,23194,12,2025,fall,"[17, 76, 306, 1211, 1261, 1416, 1554, 1696]",[852],6.78
56877,https://myanimelist.net/images/anime/1078/151796.webp,Ao no Orchestra Season 2,"Following the regular summer concert and retirement of the third-year members, Umimaku High School's Orchestra Club shifts its efforts to the upcoming national competition with a refreshed line-up focusing on the second-year members.

Amidst the cacophony produced by the inconsistent motivation levels and understanding of their repertoire, the orchestra club members struggle to achieve their ideal sound...",Web manga,['Drama'],[],1,17439,21,2025,fall,"[111, 1797]",[22],7.52
62144,https://myanimelist.net/images/anime/1311/151227.webp,"Potion, Wagami wo Tasukeru","Kaede Yakumo, an ordinary 17-year-old high school girl, unexpectedly wakes up in another world with only her backpack alongside her. After aimlessly wandering around trying to understand her whereabouts, Kaede gives up and decides to look for anything useful in her belongings, which leads her to discover an unfamiliar book. Inside, the book lists recipes for producing potions using a simple command word, ""create,"" and a note telling her to think of this new experience as a game.

With a clear path laid out in front of her, Kaede vows to use the potions she crafts for her survival—and hopefully find the person who unfairly transported her to this world in order to return home.

[Written by MAL Rewrite]",Light novel,['Fantasy'],[],0,17226,12,2025,fall,"[315, 1211, 1549, 1996]","[2844, 2983]",6.43
57189,https://myanimelist.net/images/anime/1669/151736.webp,Debu to Love to Ayamachi to!,"""This is the punishment for a fat, ugly girl like me falling in love with someone as beautiful as you..."" Yumeko had a mountain of complexes about herself. Then, a terrible accident befalls her. Though somehow saved from the brink of death, Yumeko wakes up a completely different person. ""This is...me...?! I'm SO cute!!"" Those around her can't hide their surprise and wonderment at this 180°change... But, Yumeko's new hyper-positive attitude starts to change her surroundings, too. Worries and complexes can affect anyone, and Yumeko will chop right through those of her various supporting characters!! In love, work, friendship... And an attempted murder case?! This frenzied romantic comedy will leave you bubbling with energy!

(Source: Solmare Publishing)",Web manga,"['Comedy', 'Romance']",['Shoujo'],0,16998,12,2025,fall,"[109, 719, 843, 1011, 1211, 1344, 1500, 1604, 1817, 1986, 2071, 2228, 3225]",[553],6.68
61067,https://myanimelist.net/images/anime/1296/152147.webp,Ninja to Gokudou,"Since ancient times, the ninja and the yakuza have been at war, spilling blood around the world as empires rise and fall. So when, in the modern age, Shinoha, a ninja, meets Kiwami, a gangster following the path of the yakuza—the gokudo—and discovers they have common interests, the obvious assumption is that nothing good can come of it. But can it be that one burgeoning bromance will shake up a 300-year grudge?

Who will win the struggle for real ultimate power?

(Source: Kodansha USA)",Web manga,['Action'],[],0,16223,12,2025,fall,"[159, 306, 1003, 1418, 1899, 3106]",[37],6.42
60378,https://myanimelist.net/images/anime/1736/152179.webp,Shabake,"In the Edo period, Ichitarou, the young heir to a large apothecary shop, has always been stuck in his room due to his weak constitution. As unpleasant rumors about his condition surround him, his grandfather prays for a god to send spirits that will protect the sickly boy. These two guardians, Sasuke and Nikichi, will remain by Ichitarou's side for life and safeguard his health.

As years pass, Ichitarou leaves his room more often, wanting to be helpful and ignoring those who insist that he keep resting instead. One day, Ichitarou sneaks outside without his guardians and ends up staying out until nightfall. On his way home, a bloody man suddenly begins chasing him! The quick-witted Ichitarou is able to escape and discovers the brutal murder scene.

The next day, Ichitarou hears about the murder, but there is something odd about the story—the victim had a different mortal wound from what he saw. With the murderer still at large, Ichitarou continues to gather more details about the peculiar case from humans and spirits alike, which might just lead him to unravel the mystery.

[Written by MAL Rewrite]",Novel,"['Drama', 'Mystery', 'Supernatural']",[],0,14794,13,2025,fall,"[17, 53, 166, 169, 719, 1550, 2425]",[1258],6.51
62428,https://myanimelist.net/images/anime/1889/151926.webp,Heika Watashi wo Wasurete Kudasai,"Lunia, the eldest daughter of Count Persephone, has been mistreated and cast aside by her family. One day, a letter arrives declaring that she has been chosen to marry Hades Khronoa, the duke of the Khronoa family. Although they are known as the Lords of Death and the Empire's watchdogs, Lunia humbly accepts, relieved to finally escape her father's house.

However, when she arrives at her new home, Hades refuses to love or touch her. Lunia at first agrees, but she worries about her new husband's safety. The Khronoa family heads, though powerful, are cursed to go mad or die by the age of thirty unless they conceive a child with a bride chosen by God. Priests of the empire, worried that the nation will fall should Hades die, pressures Luna into drugging him.

Seven years later, after fleeing the duke's mansion, Lunia is secretly raising her twin sons, Uranus and Helios, in a neighboring country. On the night of their conception, she had a vision of them fighting under the Khronoa family crest, fearing that they will hate each other under the power of the cursed Khronoa bloodline. Despite her concealment, Hades eventually finds her, demanding answers about why she saved him and why she ran away.

[Written by MAL Rewrite]",Manga,"['Fantasy', 'Romance']",[],0,11314,12,2025,fall,[1882],"[2844, 2983]",5.67
